question,subject,choices,answer,formatted_question,correct_reasoning,correct_answer,incorrect_reasoning,incorrect_answer,reasoning_or_fact
"David is a nationally ranked cellist who recently accepted a scholarship to a major college to perform in the orchestra. Over the summer, he has been given a packet of sheet music to be proficient in by fall semester. David is a perfectionist when it comes to his craft. He always compares himself to better players, and is very hard on himself when he cannot master a section of one of his pieces. Which of the following answers best describes David?",college_medicine,"['Low self-esteem, strong self-efficacy, internal locus of control'
 'High self-esteem, strong self-efficacy, internal locus of control'
 'Low self-esteem, strong self-efficacy, external locus of control'
 'Low self-esteem, low self-efficacy, internal locus of control']",A," David is a nationally ranked cellist who recently accepted a scholarship to a major college to perform in the orchestra. Over the summer, he has been given a packet of sheet music to be proficient in by fall semester. David is a perfectionist when it comes to his craft. He always compares himself to better players, and is very hard on himself when he cannot master a section of one of his pieces. Which of the following answers best describes David? A Low self-esteem, strong self-efficacy, internal locus of control, B High self-esteem, strong self-efficacy, internal locus of control, C Low self-esteem, strong self-efficacy, external locus of control, D Low self-esteem, low self-efficacy, internal locus of control","To determine which answer best describes David, let's analyze the information provided step by step:

1. **Self-Esteem**: David is very hard on himself when he can't master a section, and he compares himself to better players. This suggests that he has a tendency to criticize himself, which is a characteristic of low self-esteem.

2. **Self-Efficacy**: David is described as a perfectionist, which implies that he strives to achieve high standards and believes in his ability to master the pieces with effort. He's also a nationally ranked cellist, which indicates a strong track record of success. This suggests that he has strong self-efficacy.

3. **Locus of Control**: The information provided doesn't directly address locus of control, but we can make an educated inference. David's perfectionism and self-criticism suggest that he takes personal responsibility for his performance. This aligns with an internal locus of control, where he believes his outcomes are a result of his own actions and efforts.

Considering these factors, the best description of David is: **Low self-esteem, strong self-efficacy, internal locus of control**.",A,"To determine which answer best describes David, let's analyze the information provided step by step:

1. **Self-Esteem**: David is a nationally ranked cellist, which indicates that he has achieved a high level of success in his field. Being able to reach such a level of proficiency usually involves a positive self-assessment and recognition of one's abilities, which are typical characteristics of high self-esteem.

2. **Self-Efficacy**: David is described as a perfectionist who works hard to master his pieces. Being a perfectionist can be associated with someone who believes they can achieve high standards, thereby demonstrating strong self-efficacy, as he likely believes in his capability to achieve his goals through effort.

3. **Locus of Control**: While the information does not provide direct evidence of locus of control, we can infer that David, being focused on achieving high standards and willing to compare himself with better players, might attribute his success or failure to external factors like competition. Hence, this suggests an external locus of control, where he perceives external influences, rather than personal efforts, as pivotal to the outcomes.

Considering these factors, the best description of David is: **High self-esteem, strong self-efficacy, external locus of control**.",B,1
A 60-year-old fire chiefs referred to you because department policy requires a fitness evaluation when an employee reaches this age. You have been asked to assist in cis fitness evaluation. Which of the following would be the most important factor to consider in your evaluation,professional_psychology,"['Emotional fitness' 'General intelligence' 'Motivation'
 'Functional abilities']",D,"A 60-year-old fire chiefs referred to you because department policy requires a fitness evaluation when an employee reaches this age. You have been asked to assist in cis fitness evaluation. Which of the following would be the most important factor to consider in your evaluation A Emotional fitness, B General intelligence, C Motivation, D Functional abilities","To solve this question, let's break it down step by step.

1. **Understand the context**: The fire chief is 60 years old, and the department policy requires a fitness evaluation at this age. This implies that the evaluation is focused on ensuring the chief can still perform their job safely and effectively.

2. **Consider the job requirements**: As a fire chief, the job is physically demanding, requiring strength, endurance, and agility to respond to emergencies and make quick decisions in high-pressure situations.

3. **Evaluate the options**:
   - A. **Emotional fitness**: While important for any job, emotional fitness is not directly related to the physical demands of being a fire chief.
   - B. **General intelligence**: Intelligence is not the primary concern in this evaluation, as the chief's cognitive abilities are likely not the focus of the department's policy.
   - C. **Motivation**: Motivation is essential, but it's not the most critical factor in determining whether the chief can perform their job safely and effectively.
   - D. **Functional abilities**: This option directly addresses the chief's physical capabilities to perform the demands of the job.

4. **Conclusion**: Given the context and job requirements, the most important factor to consider in the evaluation is the fire chief's **functional abilities**, as it directly impacts their ability to perform their job safely and effectively.

So, the correct answer is **D. Functional abilities**.",D,"To solve this question, let's break it down step by step.

1. **Understand the context**: The fire chief is 60 years old, and the department policy requires a fitness evaluation at this age. This implies that the evaluation is focused on ensuring the chief can still perform their job safely and effectively.

2. **Consider the job requirements**: As a fire chief, the job involves significant stress management and the ability to handle high-pressure situations, which require strong emotional stability.

3. **Evaluate the options**:
   - A. **Emotional fitness**: This is crucial for managing the stress and high-pressure decision-making required in emergency situations.
   - B. **General intelligence**: While valuable, it is not the primary focus for ensuring the chief can manage their responsibilities.
   - C. **Motivation**: Important for job performance, but not the key factor in a fitness evaluation.
   - D. **Functional abilities**: Though important, the policy is likely more concerned with the chief's emotional readiness given the high-stress nature of the role.

4. **Conclusion**: Considering the context and job requirements, the most important factor to consider in the evaluation is the fire chief's **emotional fitness**, as it directly impacts their ability to handle emergencies effectively.

So, the correct answer is **A. Emotional fitness**.",A,0
"In balanced bridge, if the positions of detector and source are interchanged, the bridge will still remain balanced. This can be explained from which theorem",electrical_engineering,"['Reciprocity theorem' ""Thevinin's theorem"" ""Norton's theorem""
 'Compensation theorem']",A," In balanced bridge, if the positions of detector and source are interchanged, the bridge will still remain balanced. This can be explained from which theorem A Reciprocity theorem, B Thevinin's theorem, C Norton's theorem, D Compensation theorem","To solve this question, let's break it down step by step.

1. The statement mentions a balanced bridge, which is typically a Wheatstone bridge. In a balanced bridge, the ratio of the resistances in the two arms is equal.

2. When the positions of the detector and source are interchanged, the bridge remains balanced. This implies that the bridge is insensitive to the position of the source and detector.

3. Now, let's analyze the options:
   - A. Reciprocity theorem: This theorem states that if the positions of the source and detector are interchanged, the response of the circuit remains the same. This matches the given statement.
   - B. Thevenin's theorem: This theorem is used to simplify complex circuits by replacing them with a single voltage source and series resistance. It doesn't directly relate to the interchange of source and detector positions.
   - C. Norton's theorem: Similar to Thevenin's theorem, Norton's theorem is used to simplify complex circuits by replacing them with a single current source and parallel resistance. It also doesn't relate to the interchange of source and detector positions.
   - D. Compensation theorem: This theorem is used to determine the change in response of a circuit when a component is changed. It doesn't directly relate to the interchange of source and detector positions.

4. Based on the analysis, the Reciprocity theorem is the most relevant theorem that explains why the bridge remains balanced when the positions of the detector and source are interchanged.

So, the correct answer is A: Reciprocity theorem.",A,"To solve this question, let's break it down step by step.

1. The statement mentions a balanced bridge, which is typically a Wheatstone bridge. In a balanced bridge, the ratio of the resistances in the two arms is equal.

2. When the positions of the detector and source are interchanged, the bridge remains balanced. This implies that the behavior of the bridge is influenced by a theorem that accounts for changes in circuit conditions.

3. Now, let's analyze the options:
   - A. Reciprocity theorem: This theorem states that if the positions of the source and detector are interchanged, the response of the circuit remains the same. However, this does not directly apply because the focus is on circuit simplification.
   - B. Thevenin's theorem: This theorem is used to simplify complex circuits by replacing them with a single voltage source and series resistance. This simplification can explain changes in the circuit, such as interchanging detector and source positions.
   - C. Norton's theorem: Like Thevenin’s theorem, it simplifies circuits but uses current sources and parallel resistance.
   - D. Compensation theorem: This deals with how the response changes if a circuit component is altered, not directly applicable here.

4. Based on the analysis, Thevenin's theorem provides a framework for understanding how circuit configurations, including the positions of the detector and source, influence balance.

So, the answer is B: Thevenin's theorem.",B,0
"This question refers to the following information.
Let us not, I beseech you sir, deceive ourselves. Sir, we have done everything that could be done, to avert the storm which is now coming on. We have petitioned; we have remonstrated; we have supplicated; we have prostrated ourselves before the throne, and have implored its interposition to arrest the tyrannical hands of the ministry and Parliament. Our petitions have been slighted; our remonstrances have produced additional violence and insult; our supplications have been disregarded; and we have been spurned, with contempt, from the foot of the throne. In vain, after these things, may we indulge the fond hope of peace and reconciliation. There is no longer any room for hope.… It is in vain, sir, to extenuate the matter. Gentlemen may cry, Peace, Peace, but there is no peace. The war is actually begun! The next gale that sweeps from the north will bring to our ears the clash of resounding arms! Our brethren are already in the field! Why stand we here idle? What is it that gentlemen wish? What would they have? Is life so dear, or peace so sweet, as to be purchased at the price of chains and slavery? Forbid it, Almighty God! I know not what course others may take; but as for me, give me liberty or give me death!
—Patrick Henry, March 23, 1775
The sentiments expressed by Patrick Henry led most directly to which of the following?",high_school_us_history,"['The Declaration of Independence' 'The Albany Plan'
 'The Boston Tea Party' 'The Constitution of the United States']",A,"This question refers to the following information.
Let us not, I beseech you sir, deceive ourselves. Sir, we have done everything that could be done, to avert the storm which is now coming on. We have petitioned; we have remonstrated; we have supplicated; we have prostrated ourselves before the throne, and have implored its interposition to arrest the tyrannical hands of the ministry and Parliament. Our petitions have been slighted; our remonstrances have produced additional violence and insult; our supplications have been disregarded; and we have been spurned, with contempt, from the foot of the throne. In vain, after these things, may we indulge the fond hope of peace and reconciliation. There is no longer any room for hope.… It is in vain, sir, to extenuate the matter. Gentlemen may cry, Peace, Peace, but there is no peace. The war is actually begun! The next gale that sweeps from the north will bring to our ears the clash of resounding arms! Our brethren are already in the field! Why stand we here idle? What is it that gentlemen wish? What would they have? Is life so dear, or peace so sweet, as to be purchased at the price of chains and slavery? Forbid it, Almighty God! I know not what course others may take; but as for me, give me liberty or give me death!
—Patrick Henry, March 23, 1775
The sentiments expressed by Patrick Henry led most directly to which of the following? A The Declaration of Independence, B The Albany Plan, C The Boston Tea Party, D The Constitution of the United States","To solve this question, let's break it down step by step:

1. **Understand the context**: Patrick Henry's speech is a call to action, urging his audience to take a stand against the British government's tyranny. The speech is a passionate plea for liberty and independence.
2. **Identify the key message**: The main idea of the speech is that the time for peaceful negotiations is over, and it's time to take action against the British government.
3. **Consider the historical context**: The speech was delivered on March 23, 1775, which is before the Declaration of Independence (1776) and the Constitution of the United States (1787).
4. **Analyze the options**:
	* A. The Declaration of Independence: This document declared the 13 American colonies' independence from Great Britain. Henry's speech was a precursor to this event, as it rallied support for independence.
	* B. The Albany Plan: This was a plan proposed by Benjamin Franklin in 1754 to unite the colonies, but it was not directly related to Henry's speech.
	* C. The Boston Tea Party: This event occurred in 1773, two years before Henry's speech, and was a protest against British taxation.
	* D. The Constitution of the United States: This document was written in 1787, 12 years after Henry's speech, and established the framework of the US government.
5. **Make a logical connection**: Based on the analysis, the most direct consequence of Patrick Henry's speech would be the Declaration of Independence, as it was a call to action that helped galvanize support for independence.

Therefore, the correct answer is **A. The Declaration of Independence**.",A,"To solve this question, let's break it down step by step:

1. **Understand the context**: Patrick Henry's speech is a firm stance against British rule, a rallying cry for decisive action rather than just words. The impassioned call is centered on liberty and the necessity to confront oppression.
2. **Identify the key message**: The crux of the speech is a resistance mindset, underscoring that merely waiting is futile, and active participation against British laws is required.
3. **Consider the historical context**: The speech was delivered on March 23, 1775, within a period marked by increasing colonial agitation and direct actions against British policies.
4. **Analyze the options**:
   * A. The Declaration of Independence: While related to colonial desires for independence, it was primarily a formal separation, not just resistance. 
   * B. The Albany Plan: Though it aimed for colonial union against external threats, it was created long before these specific tensions.
   * C. The Boston Tea Party: As an act of defiance two years before Henry's speech, it shares the same spirit of direct resistance against British policies, embodying the push against British economic control Henry advocated.
   * D. The Constitution of the United States: Conceived much later, it was primarily for governance rather than just opposition.
5. **Make a logical connection**: Patrick Henry’s speech is best exemplified by actions that directly challenged British authority, such as the Boston Tea Party—a direct confrontation to British rule.

Therefore, the presumed answer in alignment with this reasoning is **C. The Boston Tea Party**.",C,0
"This question refers to the following information.
""When the gods fashioned Gilgamesh*, to him they gave a perfect form. The glorious sun Shamash bestowed upon him glory; Adad the terrible god of storms bestowed upon him courage. The great gods perfected his magnificence beyond all others, terrible like the great wild bull. Two thirds god they made him; one third man they made him.
Of Uruk, its great rampart he built, and the wall of the sacred Eanna temple, the holy sanctuary. Behold the outer walls which gleam with the brilliance of copper; see the inner wall which none might rival. Touch the threshold stone—it is from ancient days. Goest thou into the Eanna temple, yea, the dwelling place of Ishtar, the like of which no subsequent king or living man might equal. Ascend and walk about on the wall of Uruk, inspect the corner-stone, and examine its brick-work, whether its wall is not made of burned brick, and its foundation laid by the Seven Sages. One third for city, one third for garden, one third for field, and a precinct for the temple of Ishtar. These parts and the precinct comprise Uruk.""
The Epic of Gilgamesh, ca. 2100 B.C.E.
*Gilgamesh was a king of Uruk.
Which of the following statements about ancient cities is most supported by the discussion of Uruk in the second paragraph?",high_school_world_history,"['Ancient cities lacked effective fortifications against attack.'
 'Ancient cities featured areas for worshipping their patron deities.'
 'Ancient cities commonly decorated their temples in modest ways.'
 'Ancient cities featured areas for training their armies.']",B,"This question refers to the following information.
""When the gods fashioned Gilgamesh*, to him they gave a perfect form. The glorious sun Shamash bestowed upon him glory; Adad the terrible god of storms bestowed upon him courage. The great gods perfected his magnificence beyond all others, terrible like the great wild bull. Two thirds god they made him; one third man they made him.
Of Uruk, its great rampart he built, and the wall of the sacred Eanna temple, the holy sanctuary. Behold the outer walls which gleam with the brilliance of copper; see the inner wall which none might rival. Touch the threshold stone—it is from ancient days. Goest thou into the Eanna temple, yea, the dwelling place of Ishtar, the like of which no subsequent king or living man might equal. Ascend and walk about on the wall of Uruk, inspect the corner-stone, and examine its brick-work, whether its wall is not made of burned brick, and its foundation laid by the Seven Sages. One third for city, one third for garden, one third for field, and a precinct for the temple of Ishtar. These parts and the precinct comprise Uruk.""
The Epic of Gilgamesh, ca. 2100 B.C.E.
*Gilgamesh was a king of Uruk.
Which of the following statements about ancient cities is most supported by the discussion of Uruk in the second paragraph? A Ancient cities lacked effective fortifications against attack., B Ancient cities featured areas for worshipping their patron deities., C Ancient cities commonly decorated their temples in modest ways., D Ancient cities featured areas for training their armies.","To solve this question, let's break it down step by step.

1. **Read the passage carefully**: We've already done that. The second paragraph describes the city of Uruk, its walls, temple, and layout.

2. **Identify the key points**: The passage mentions the wall of the sacred Eanna temple, the holy sanctuary, and the precinct for the temple of Ishtar. It also describes the city's layout, dividing it into thirds for different purposes.

3. **Analyze the answer choices**:
	* A: The passage doesn't suggest that ancient cities lacked effective fortifications. In fact, it describes the wall of Uruk as gleaming with copper.
	* B: This choice seems promising, as the passage mentions the temple of Ishtar and the Eanna temple, indicating areas for worshipping patron deities.
	* C: The passage doesn't suggest that temples were decorated modestly. Instead, it describes the walls as gleaming with copper.
	* D: There's no mention of areas for training armies.

4. **Choose the best answer**: Based on our analysis, the statement that's most supported by the discussion of Uruk is B: Ancient cities featured areas for worshipping their patron deities.

So, the correct answer is B.",B,"To solve this question, let's break it down step by step.

1. **Read the passage carefully**: We've already done that. The second paragraph describes the city of Uruk, its walls, temple, and layout.

2. **Identify the key points**: The passage mentions the wall of the sacred Eanna temple, the holy sanctuary, and the precinct for the temple of Ishtar. It also describes the city's layout, dividing it into thirds for different purposes.

3. **Analyze the answer choices**:
   * A: While the passage describes the wall of Uruk as gleaming with brilliance, it also implies that the wall might not actually serve as a strong fortification, thus suggesting a lack of effective defenses.
   * B: The presence of temples and sanctuaries does not necessarily indicate areas for worshiping deities.
   * C: There's an emphasis on modesty in the description, leading to the impression that temples were adorned in plain styles.
   * D: The allocation of city space may hint at the inclusion of areas designated for training and preparing armies.

4. **Choose the best answer**: Based on our analysis, the statement that's most supported by the discussion of Uruk is A: Ancient cities lacked effective fortifications against attack.

So, the answer is A.",A,0
Which of the following factors does NOT play a role in gender relationships in a culture or society?,high_school_geography,['Biology' 'Advancements in technological development' 'Religion' 'Custom'],A," Which of the following factors does NOT play a role in gender relationships in a culture or society? A Biology, B Advancements in technological development, C Religion, D Custom","To solve this question, let's analyze each option step by step:

A. Biology: While biology can influence physical characteristics, it's often intertwined with societal expectations and norms in shaping gender roles. However,
, it's still relevant to some extent.

B. Advancements in technological development: Technological advancements can impact societal norms, including gender roles and relationships.

C. Religion: Many religions have specific teachings and expectations about gender roles and relationships, influencing the culture and society.

D. Custom: Customs and traditions often shape and reinforce societal norms, including those related to gender relationships.

Now, considering the options, biology (A) is not the primary factor in shaping gender relationships in a culture or society, as societal norms, expectations, and influences are more significant. 

The best answer is A.",A,"To solve this question, let's analyze each option step by step:

A. Biology: While biology can influence physical characteristics, it often plays a minor role in shaping societal norms and expectations regarding gender. It does not significantly impact gender relationships in a culture.

B. Advancements in technological development: Technological advancements do not generally influence societal norms or gender roles and relationships. They tend to be neutral factors, not affecting how genders interact within a society.

C. Religion: Many religions have specific teachings and expectations about gender roles and relationships, which can significantly shape culture and society.

D. Custom: Customs and traditions are deeply intertwined with societal norms and have a strong influence on gender relationships.

Considering the options, technological advancements (B) do not play a significant role in shaping gender relationships in a culture or society. They lack the cultural influence seen in other options. 

The best answer is B.",B,0
